Pillar Cluster,Pillar URL,Subcluster,URL,Page Type (Detailed),Search Intent,Primary Target Keyword,Anchor Option 1 (Exact),Anchor Option 2,Anchor Option 3,Anchor Option 4,Anchor Option 5
Digital Products,https://omnipress.com/digital-products/,Digital Products,https://omnipress.com/blog/gated-vs-ungated-content-finding-the-right-balance-for-associations/,Blog Post,Informational,gated vs ungated content,gated vs ungated content,ai and content strategy,how gated vs ungated content works,see how Omnipress supports gated vs ungated content,
Digital Products,https://omnipress.com/digital-products/,Digital Products,https://omnipress.com/blog/how-to-repurpose-conference-content-for-year-round-engagement/,Blog Post,Informational,repurpose conference content,repurpose conference content,association communications strategy,how repurpose conference content works,see how Omnipress supports repurpose conference content,
Digital Products,https://omnipress.com/digital-products/,Digital Products,https://omnipress.com/blog/omnipress-launches-new-mobile-app-that-upgrades-the-event-experience/,Blog Post,Informational,conference mobile event app,conference mobile event app,engagefully,how a mobile event app keeps attendees engaged,see how Omnipress supports conference mobile event app,
Digital Products,https://omnipress.com/digital-products/,Digital Products,https://omnipress.com/blog/selecting-mobile-event-app-conference/,Blog Post,Commercial Investigation,select a mobile event app,select a mobile event app,conference app,how a mobile event app keeps attendees engaged,see how Omnipress supports select a mobile event app,
Digital Products,https://omnipress.com/digital-products/,Digital Products,https://omnipress.com/conferences/digital-conference-flipbook/,Product,Commercial Investigation,digital conference flipbook,digital conference flipbook,digital conference program,how to deliver conference content online,see how Omnipress supports digital conference flipbook,
Digital Products,https://omnipress.com/digital-products/,Digital Products,https://omnipress.com/conferences/event-app/,Product,Commercial Investigation,mobile event app,mobile event app,conference app,how a mobile event app keeps attendees engaged,see how Omnipress supports mobile event app,
Digital Products,https://omnipress.com/digital-products/,Digital Products,https://omnipress.com/conferences/virtual-conference-event-platform/,Product,Commercial Investigation,virtual event platform,virtual event platform,virtual conference platform,virtual event software,how a virtual event platform extends engagement,our virtual event platform
Digital Products,https://omnipress.com/digital-products/,Digital Products,https://omnipress.com/customers/the-international-wire-cable-symposium/,Customer Story,Commercial Investigation,virtual event platform case study,virtual event platform case study,virtual event software case study,how a virtual event platform extends engagement,see how The International Wire and Cable Symposium (IWCS) worked with Omnipress,
Digital Products,https://omnipress.com/digital-products/,Digital Products,https://omnipress.com/publications/digital-publications/,Product,Commercial Investigation,digital publication platform,digital publication platform,online publications platform,digital publication software,how associations deliver member publications,our digital publication platform
Digital Products,https://omnipress.com/digital-products/,Digital Products,https://omnipress.com/stories/mobile-event-app/,Stories Topic Hub,Commercial Investigation,mobile event app customer stories,mobile event app customer stories,case studies,how a mobile event app keeps attendees engaged,customer stories about Digital Products,
Digital Products,https://omnipress.com/digital-products/,Digital Products,https://omnipress.com/stories/virtual-event-platform/,Stories Topic Hub,Commercial Investigation,virtual event platform customer stories,virtual event platform customer stories,case studies,virtual event software customer stories,how a virtual event platform extends engagement,customer stories about Digital Products
Digital Products,https://omnipress.com/digital-products/,Digital Products,https://omnipress.com/videos/omnipress-mobile-event-app-quick-tour/,Video,Informational,omnipress mobile event app quick tour,omnipress mobile event app quick tour,how a mobile event app keeps attendees engaged,watch: Omnipress Mobile Event App Quick Tour,,
Digital Products,https://omnipress.com/digital-products/,Digital Products,https://omnipress.com/videos/omnipress-virtual-event-platform-quick-tour/,Video,Informational,omnipress virtual event platform quick tour,omnipress virtual event platform quick tour,omnipress virtual event software quick tour,how a virtual event platform extends engagement,watch: Omnipress Virtual Event Platform Quick Tour,
Digital Products,https://omnipress.com/digital-products/,Digital Products,https://omnipress.com/videos/quick-tour-omnipress-digital-conference-flipbook/,Video,Informational,quick tour: omnipress digital conference flipbook,quick tour: omnipress digital conference flipbook,how to deliver conference content online,watch: Quick Tour: Omnipress Digital Conference Flipbook,,
Print & Fulfillment,https://omnipress.com/print-and-fulfillment-services/,,https://omnipress.com/print-and-fulfillment-services/,Main Service,Commercial Investigation,print and fulfillment services,print and fulfillment services,printing and fulfillment services,print and fulfillment,how print fulfillment works end-to-end,see how Omnipress supports print and fulfillment
Print & Fulfillment,https://omnipress.com/print-and-fulfillment-services/,Print & Fulfillment,https://omnipress.com/bindings-tabs-finishes/,Service,Commercial Investigation,binding options for printed materials,binding options for printed materials,manual binding options,how print fulfillment works end-to-end,see how Omnipress supports binding options for printed materials,
Print & Fulfillment,https://omnipress.com/print-and-fulfillment-services/,Print & Fulfillment,https://omnipress.com/blog/book-binding-101-conference-materials-educational-publications/,Blog Post,Informational,book binding options,book binding options,education,how print fulfillment works end-to-end,see how Omnipress supports book binding options,
Print & Fulfillment,https://omnipress.com/print-and-fulfillment-services/,Print & Fulfillment,https://omnipress.com/blog/four-questions-your-print-and-fulfillment-rfp-should-include/,Blog Post,Commercial Investigation,print and fulfillment rfp,print and fulfillment rfp,fulfillment,how print fulfillment works end-to-end,see how Omnipress supports print and fulfillment rfp,
Print & Fulfillment,https://omnipress.com/print-and-fulfillment-services/,Print & Fulfillment,https://omnipress.com/blog/how-to-choose-print-fulfillment-partner/,Blog Post,Commercial Investigation,print and fulfillment partner,print and fulfillment partner,choosing a print vendor,how print fulfillment works end-to-end,see how Omnipress supports print and fulfillment partner,
Print & Fulfillment,https://omnipress.com/print-and-fulfillment-services/,Print & Fulfillment,https://omnipress.com/blog/print-fulfillment-rfp-transition-guide/,Proposed PILLAR Blog,Informational,print and fulfillment services rfp,print and fulfillment services rfp,print fulfillment services,print and fulfillment rfp,how print fulfillment works end-to-end,see how Omnipress supports print and fulfillment rfp
Print & Fulfillment,https://omnipress.com/print-and-fulfillment-services/,Print & Fulfillment,https://omnipress.com/blog/top-print-project-mistakes-that-slow-things-down/,Blog Post,Informational,print file prep checklist,print file prep checklist,binding and trim setup,how print fulfillment works end-to-end,see how Omnipress supports print file prep checklist,
Print & Fulfillment,https://omnipress.com/print-and-fulfillment-services/,Print & Fulfillment,https://omnipress.com/blog/what-is-print-and-fulfillment/,Blog Post,Informational,print and fulfillment,print and fulfillment,association publications,how print fulfillment works end-to-end,see how Omnipress supports print and fulfillment,
Print & Fulfillment,https://omnipress.com/print-and-fulfillment-services/,Print & Fulfillment,https://omnipress.com/customers/aj-tutoring/,Customer Story,Commercial Investigation,print & fulfillment case study,print & fulfillment case study,printed materials,how print fulfillment works end-to-end,see how AJ Tutoring simplified print fulfillment,
Print & Fulfillment,https://omnipress.com/print-and-fulfillment-services/,Print & Fulfillment,https://omnipress.com/customers/emathinstruction/,Customer Story,Commercial Investigation,print & fulfillment case study,print & fulfillment case study,how print fulfillment works end-to-end,see how eMATHinstruction simplified print fulfillment,,
Print & Fulfillment,https://omnipress.com/print-and-fulfillment-services/,Print & Fulfillment,https://omnipress.com/customers/international-facility-management-association/,Customer Story,Commercial Investigation,print & fulfillment case study,print & fulfillment case study,how print fulfillment works end-to-end,see how International Facility Management Association simplified print fulfillment,,
Print & Fulfillment,https://omnipress.com/print-and-fulfillment-services/,Print & Fulfillment,https://omnipress.com/customers/international-information-systems-security-certification-consortium/,Customer Story,Commercial Investigation,print & fulfillment case study,print & fulfillment case study,how print fulfillment works end-to-end,see how International Information Systems Security Certification Consortium simplified print fulfillment,,
Print & Fulfillment,https://omnipress.com/print-and-fulfillment-services/,Print & Fulfillment,https://omnipress.com/customers/national-association-of-nephrology-technicians-technologists/,Customer Story,Commercial Investigation,print & fulfillment case study,print & fulfillment case study,how print fulfillment works end-to-end,see how National Association of Nephrology Technicians / Technologists simplified print fulfillment,,
Print & Fulfillment,https://omnipress.com/print-and-fulfillment-services/,Print & Fulfillment,https://omnipress.com/customers/national-retail-federation-foundation/,Customer Story,Commercial Investigation,print & fulfillment case study,print & fulfillment case study,how print fulfillment works end-to-end,see how National Retail Federation Foundation simplified print fulfillment,,
Print & Fulfillment,https://omnipress.com/print-and-fulfillment-services/,Print & Fulfillment,https://omnipress.com/resources/print-prep-resources/,Resource,Informational,print prep resources,print prep resources,print-ready files,how print fulfillment works end-to-end,print-prep resource: Print Prep Resources,
Print & Fulfillment,https://omnipress.com/print-and-fulfillment-services/,Print & Fulfillment,https://omnipress.com/resources/print-prep-resources/divider-sheets-stock-colors/,Resource,Informational,divider sheets stock colors,divider sheets stock colors,print prep,how print fulfillment works end-to-end,print-prep resource: Divider Sheets Stock Colors,
Print & Fulfillment,https://omnipress.com/print-and-fulfillment-services/,Print & Fulfillment,https://omnipress.com/resources/print-prep-resources/index-tab-stock-colors/,Resource,Informational,index tab stock colors,index tab stock colors,print prep,how print fulfillment works end-to-end,print-prep resource: Index Tab Stock Colors,
Print & Fulfillment,https://omnipress.com/print-and-fulfillment-services/,Print & Fulfillment,https://omnipress.com/resources/print-prep-resources/plastic-coil-colors/,Resource,Informational,plastic coil colors,plastic coil colors,print prep,how print fulfillment works end-to-end,print-prep resource: Plastic Coil Colors,
Print & Fulfillment,https://omnipress.com/print-and-fulfillment-services/,Print & Fulfillment,https://omnipress.com/resources/print-prep-resources/uncoated-cover-stock-colors/,Resource,Informational,uncoated cover stock colors,uncoated cover stock colors,print prep,how print fulfillment works end-to-end,print-prep resource: Uncoated Cover Stock Colors,
Print & Fulfillment,https://omnipress.com/print-and-fulfillment-services/,Print & Fulfillment,https://omnipress.com/resources/print-prep-resources/vinyl-binder-stock-colors/,Resource,Informational,vinyl binder stock colors,vinyl binder stock colors,print prep,how print fulfillment works end-to-end,print-prep resource: Vinyl Binder Stock Colors,
Print & Fulfillment,https://omnipress.com/print-and-fulfillment-services/,Print & Fulfillment,https://omnipress.com/stories/print-fulfillment/,Stories Topic Hub,Commercial Investigation,print and fulfillment customer stories,print and fulfillment customer stories,case studies,how print fulfillment works end-to-end,customer stories about Print & Fulfillment,
Print & Fulfillment,https://omnipress.com/print-and-fulfillment-services/,Print & Fulfillment,https://omnipress.com/training/fulfillment/,Service,Commercial Investigation,print fulfillment services for training materials,print fulfillment services for training materials,print fulfillment services,print fulfillment for training materials,how print fulfillment works end-to-end,see how Omnipress supports print fulfillment for training materials
Print & Fulfillment,https://omnipress.com/print-and-fulfillment-services/,Print & Fulfillment,https://omnipress.com/training/fulfillment/5-easy-steps-to-a-successful-print-fulfillment-transition/,Resource,Informational,Print & Fulfillment:,Print & Fulfillment:,print fulfillment transition,how print fulfillment works end-to-end,print-prep resource: Print & Fulfillment:,
Print & Fulfillment,https://omnipress.com/print-and-fulfillment-services/,Print & Fulfillment,https://omnipress.com/videos/a-member-benefit-in-an-unexpected-place/,Video,Informational,a member benefit in an unexpected place,a member benefit in an unexpected place,how print fulfillment works end-to-end,watch: A Member Benefit in an Unexpected Place,,
Print & Fulfillment,https://omnipress.com/print-and-fulfillment-services/,Print & Fulfillment,https://omnipress.com/videos/omnipress-print-and-fulfillment-for-training-materials/,Video,Informational,print & fulfillment for training materials | omnipress,print & fulfillment for training materials | omnipress,how print fulfillment works end-to-end,watch: Print & Fulfillment for Training Materials | Omnipress,,
Print & Fulfillment,https://omnipress.com/print-and-fulfillment-services/,Print & Fulfillment,https://omnipress.com/videos/print-and-fulfillment-with-omnipress/,Video,Informational,omnipress print & fulfillment services | training materials made easy,omnipress print & fulfillment services | training materials made easy,omnipress print & fulfillment | training materials made easy,how print fulfillment works end-to-end,watch: Omnipress Print & Fulfillment Services | Training Materials Made Easy,
Publications,https://omnipress.com/publications/,,https://omnipress.com/publications/,Main Service,Commercial Investigation,member publication printing,member publication printing,standards book printing,how associations deliver member publications,see how Omnipress supports member publication printing,
Publications,https://omnipress.com/publications/,Publications,https://omnipress.com/blog/member-publications-print-fulfillment-digital-guide/,Proposed PILLAR Blog,Informational,member publications guide,member publications guide,member publication printing,how associations deliver member publications,see how Omnipress supports member publications guide,
Publications,https://omnipress.com/publications/,Publications,https://omnipress.com/publications/publication-printing/,Service,Commercial Investigation,publication printing services,publication printing services,journal printing services,publication printing,how associations deliver member publications,see how Omnipress supports publication printing
Training & Education,https://omnipress.com/training/,,https://omnipress.com/training/,Main Service,Commercial Investigation,training material printing,training material printing,training manuals printing,how printed training materials support learning,see how Omnipress supports training material printing,
Training & Education,https://omnipress.com/training/,Training & Education,https://omnipress.com/blog/3-reasons-to-use-qr-codes-in-your-training-course/,Blog Post,Informational,QR codes for training,QR codes for training,blended learning,how printed training materials support learning,see how Omnipress supports QR codes for training,
Training & Education,https://omnipress.com/training/,Training & Education,https://omnipress.com/blog/5-things-associations-should-know-about-gen-z/,Blog Post,Informational,engaging gen z members,engaging gen z members,association marketing strategy,how printed training materials support learning,see how Omnipress supports engaging gen z members,
Training & Education,https://omnipress.com/training/,Training & Education,https://omnipress.com/blog/applying-micro-learning-concepts-printed-course-materials/,Blog Post,Informational,microlearning printed course materials,microlearning printed course materials,continuing education,how printed training materials support learning,see how Omnipress supports microlearning printed course materials,
Training & Education,https://omnipress.com/training/,Training & Education,https://omnipress.com/blog/are-printed-training-materials-still-relevant-in-an-elearning-world/,Blog Post,Informational,printed training materials,printed training materials,adult learning theory,how printed training materials support learning,see how Omnipress supports printed training materials,
Training & Education,https://omnipress.com/training/,Training & Education,https://omnipress.com/blog/are-your-educational-programs-ready-for-gen-z/,Blog Post,Informational,gen z learning preferences,gen z learning preferences,association membership growth,how printed training materials support learning,see how Omnipress supports gen z learning preferences,
Training & Education,https://omnipress.com/training/,Training & Education,https://omnipress.com/blog/association-professional-development-guide/,Proposed PILLAR Blog,Informational,association professional development,association professional development,continuing education strategy,how printed training materials support learning,see how Omnipress supports association professional development,
Training & Education,https://omnipress.com/training/,Training & Education,https://omnipress.com/blog/bridging-the-gap-how-associations-can-reimagine-professional-development/,Blog Post,Informational,association professional development,association professional development,bridging the gap,how printed training materials support learning,see how Omnipress supports association professional development,
Training & Education,https://omnipress.com/training/,Training & Education,https://omnipress.com/blog/combining-ai-with-printed-course-materials-to-enhance-in-person-training/,Blog Post,Informational,ai for in-person training,ai for in-person training,adaptive learning technology,how printed training materials support learning,see how Omnipress supports ai for in-person training,
Training & Education,https://omnipress.com/training/,Training & Education,https://omnipress.com/blog/creating-printed-training-materials-that-support-bite-sized-learning/,Blog Post,Informational,printed training materials for microlearning,printed training materials for microlearning,bite sized learning,how printed training materials support learning,see how Omnipress supports printed training materials for microlearning,
Training & Education,https://omnipress.com/training/,Training & Education,https://omnipress.com/blog/fast-data-educational-programs-agile/,Blog Post,Informational,ai in continuing education,ai in continuing education,artificial intelligence and learning,how printed training materials support learning,see how Omnipress supports ai in continuing education,
Training & Education,https://omnipress.com/training/,Training & Education,https://omnipress.com/blog/focus-12-traits-effective-adult-learning-infographic/,Blog Post,Informational,adult learning principles,adult learning principles,adult learning,how printed training materials support learning,see how Omnipress supports adult learning principles,
Training & Education,https://omnipress.com/training/,Training & Education,https://omnipress.com/blog/future-continuing-education-k-12-classroom/,Blog Post,Informational,future of continuing education,future of continuing education,continuing education,how printed training materials support learning,see how Omnipress supports future of continuing education,
Training & Education,https://omnipress.com/training/,Training & Education,https://omnipress.com/blog/harnessing-ai-for-associations-enhancing-educational-content-and-member-engagement/,Blog Post,Informational,ai for associations,ai for associations,ai adoption challenges,how printed training materials support learning,see how Omnipress supports ai for associations,
Training & Education,https://omnipress.com/training/,Training & Education,https://omnipress.com/blog/how-associations-can-better-compete-in-a-growing-training-market/,Blog Post,Informational,association training programs,association training programs,association education strategy,how printed training materials support learning,see how Omnipress supports association training programs,
Training & Education,https://omnipress.com/training/,Training & Education,https://omnipress.com/blog/how-associations-can-repurpose-content-to-save-time/,Blog Post (Series),Informational,repurpose content for associations,repurpose content for associations,association learning strategy,how printed training materials support learning,see how Omnipress supports repurpose content for associations,
Training & Education,https://omnipress.com/training/,Training & Education,https://omnipress.com/blog/how-associations-can-use-ai-to-personalize-learning/,Blog Post (Series),Informational,AI personalized learning,AI personalized learning,accessibility and inclusion,how printed training materials support learning,see how Omnipress supports AI personalized learning,
Training & Education,https://omnipress.com/training/,Training & Education,https://omnipress.com/blog/how-to-design-materials-that-make-learning-stick/,Blog Post (Series),Informational,training material design,training material design,association learning design,how printed training materials support learning,see how Omnipress supports training material design,
Training & Education,https://omnipress.com/training/,Training & Education,https://omnipress.com/blog/how-to-refresh-your-training-manuals-for-todays-learners/,Blog Post,Informational,refresh training manuals,refresh training manuals,blended learning materials,how printed training materials support learning,see how Omnipress supports refresh training manuals,
Training & Education,https://omnipress.com/training/,Training & Education,https://omnipress.com/blog/post_series/bridging-the-gap-in-association-professional-development/,Blog Series Hub,Navigational,association professional development series,association professional development series,how printed training materials support learning,see how Omnipress supports association professional development series,,
Training & Education,https://omnipress.com/training/,Training & Education,https://omnipress.com/blog/printed-training-materials-design-tips-for-learning-retention/,Blog Post,Informational,printed training materials design,printed training materials design,adult learning,how printed training materials support learning,see how Omnipress supports printed training materials design,
Training & Education,https://omnipress.com/training/,Training & Education,https://omnipress.com/blog/printed-training-materials-guide/,Proposed PILLAR Blog,Informational,printed training materials,printed training materials,training manual printing,how printed training materials support learning,see how Omnipress supports printed training materials,
Training & Education,https://omnipress.com/training/,Training & Education,https://omnipress.com/blog/qr-codes-deliver-just-in-time-training-learning/,Blog Post,Informational,QR codes for training,QR codes for training,association learning,how printed training materials support learning,see how Omnipress supports QR codes for training,
Training & Education,https://omnipress.com/training/,Training & Education,https://omnipress.com/blog/simple-seo-tips-to-grow-your-conferences-and-courses/,Blog Post,Informational,SEO for educational programs,SEO for educational programs,ai search experience sge,how printed training materials support learning,see how Omnipress supports SEO for educational programs,
Training & Education,https://omnipress.com/training/,Training & Education,https://omnipress.com/blog/the-future-of-association-learning/,Blog Post (Series),Informational,future of association learning,future of association learning,accessibility in education,how printed training materials support learning,see how Omnipress supports future of association learning,
Training & Education,https://omnipress.com/training/,Training & Education,https://omnipress.com/blog/the-impact-of-ai-on-association-educational-content/,Blog Post,Informational,AI in association education,AI in association education,ai adoption in associations,how printed training materials support learning,see how Omnipress supports AI in association education,
Training & Education,https://omnipress.com/training/,Training & Education,https://omnipress.com/blog/training-materials-handwritten-engagement/,Blog Post,Informational,handwritten engagement in training,handwritten engagement in training,adult learning,how printed training materials support learning,see how Omnipress supports handwritten engagement in training,
