Pillar Cluster,Pillar URL,Subcluster,URL,Page Type (Detailed),Search Intent,Primary Target Keyword,Anchor Option 1 (Exact),Anchor Option 2,Anchor Option 3,Anchor Option 4,Anchor Option 5
Abstract & Application Management,https://omnipress.com/abstract-and-application-management/,,https://omnipress.com/abstract-and-application-management/,Product Hub,Commercial Investigation,abstract and application management software,abstract and application management software,submission and review management software,abstract and application management platform,how abstract management works,our abstract and application management platform
Abstract & Application Management,https://omnipress.com/abstract-and-application-management/,Abstract & Application Management,https://omnipress.com/blog/10-tips-for-writing-instructions-for-your-call-for-papers/,Blog Post,Informational,call for papers instructions,call for papers instructions,abstract collection systems,how abstract management works,see how Omnipress supports call for papers instructions,
Abstract & Application Management,https://omnipress.com/abstract-and-application-management/,Abstract & Application Management,https://omnipress.com/blog/5-must-know-tips-for-choosing-the-right-abstract-management-system/,Blog Post,Commercial Investigation,choose an abstract management system,choose an abstract management system,abstract management software,how abstract management works,our choose an abstract management platform,
Abstract & Application Management,https://omnipress.com/abstract-and-application-management/,Abstract & Application Management,https://omnipress.com/blog/abstract-management-call-for-papers-pro-tips/,Blog Post,Informational,call for papers best practices,abstract collection systems,how abstract management works,,,
Abstract & Application Management,https://omnipress.com/abstract-and-application-management/,Abstract & Application Management,https://omnipress.com/blog/beginners-guide-to-abstract-management/,Blog Post,Informational,abstract management,abstract management,abstract management system,how abstract management works,our abstract management platform,
Abstract & Application Management,https://omnipress.com/abstract-and-application-management/,Abstract & Application Management,https://omnipress.com/blog/everything-you-need-to-know-about-testing-your-abstract-management-system/,Blog Post,Informational,abstract management system testing,abstract management system testing,abstract management software testing,how abstract management works,our abstract management testing platform,
Abstract & Application Management,https://omnipress.com/abstract-and-application-management/,Abstract & Application Management,https://omnipress.com/blog/expert-tips-for-managing-conference-abstract-reviews/,Blog Post,Informational,conference abstract review process,conference abstract review process,abstract management system,how abstract management works,see how Omnipress supports conference abstract review process,
Abstract & Application Management,https://omnipress.com/abstract-and-application-management/,Abstract & Application Management,https://omnipress.com/blog/get-your-team-on-board-with-abstract-management-software/,Blog Post,Informational,abstract management software adoption,abstract management software adoption,abstract management software,abstract management platform adoption,how abstract management works,our abstract management adoption platform
Abstract & Application Management,https://omnipress.com/abstract-and-application-management/,Abstract & Application Management,https://omnipress.com/blog/how-to-build-contingency-planning-into-your-call-for-papers/,Blog Post,Informational,call for papers contingency planning,call for papers contingency planning,abstract collection systems,how abstract management works,see how Omnipress supports call for papers contingency planning,
Abstract & Application Management,https://omnipress.com/abstract-and-application-management/,Abstract & Application Management,https://omnipress.com/blog/how-to-set-up-your-abstract-management-system-for-better-speaker-submissions/,Blog Post,Informational,abstract management system setup,abstract management system setup,abstract management system,how abstract management works,our abstract management setup platform,
Abstract & Application Management,https://omnipress.com/abstract-and-application-management/,Abstract & Application Management,https://omnipress.com/blog/infographic-10-easy-ways-promote-call-papers/,Blog Post (Infographic),Informational,promote call for papers,promote call for papers,abstract management,how abstract management works,see how Omnipress supports promote call for papers,
Abstract & Application Management,https://omnipress.com/abstract-and-application-management/,Abstract & Application Management,https://omnipress.com/blog/more-ways-to-use-an-abstract-management-system/,Blog Post,Commercial Investigation,uses of abstract management system,uses of abstract management system,abstract collection systems,how abstract management works,our uses of abstract management platform,
Abstract & Application Management,https://omnipress.com/abstract-and-application-management/,Abstract & Application Management,https://omnipress.com/blog/submission-and-review-management-software-guide/,Proposed PILLAR Blog,Informational,submission and review management software,submission and review management software,abstract management software,submission and review management platform,how abstract management works,our submission and review management platform
Abstract & Application Management,https://omnipress.com/abstract-and-application-management/,Abstract & Application Management,https://omnipress.com/blog/why-charge-for-abstract-submissions-a-new-planners-guide/,Blog Post,Informational,abstract submission fee,abstract submission fee,abstract management system,how abstract management works,see how Omnipress supports abstract submission fee,
Abstract & Application Management,https://omnipress.com/abstract-and-application-management/,Abstract & Application Management,https://omnipress.com/conferences/abstract-management/,Product,Commercial Investigation,abstract management software,abstract management software,call for papers software,abstract management platform,how abstract management works,our abstract management platform
Abstract & Application Management,https://omnipress.com/abstract-and-application-management/,Abstract & Application Management,https://omnipress.com/conferences/abstract-management/catalyst-features-videos/,Product Supporting,Informational,abstract management software features,abstract management software features,CATALYST features videos,abstract management platform features,how abstract management works,our abstract management features platform
Abstract & Application Management,https://omnipress.com/abstract-and-application-management/,Abstract & Application Management,https://omnipress.com/conferences/abstract-management/catalyst-quick-tips/,Product Supporting,Informational,abstract management tips,abstract management tips,call for papers tips,how abstract management works,our abstract management tips platform,
Abstract & Application Management,https://omnipress.com/abstract-and-application-management/,Abstract & Application Management,https://omnipress.com/customers/california-speech-language-hearing-association/,Customer Story,Commercial Investigation,abstract management case study,abstract management case study,how abstract management works,see how California Speech-Language-Hearing Association (CSHA) streamlined abstract submissions,,
Abstract & Application Management,https://omnipress.com/abstract-and-application-management/,Abstract & Application Management,https://omnipress.com/customers/cit-international/,Customer Story,Commercial Investigation,abstract management case study,abstract management case study,how abstract management works,see how International Crisis Intervention Team (CIT International) streamlined abstract submissions,,
Abstract & Application Management,https://omnipress.com/abstract-and-application-management/,Abstract & Application Management,https://omnipress.com/customers/geo-institute-american-society-of-civil-engineers/,Customer Story,Commercial Investigation,abstract management case study,abstract management case study,mobile event app,how abstract management works,"see how Geo-Institute, ASCE streamlined abstract submissions",
Abstract & Application Management,https://omnipress.com/abstract-and-application-management/,Abstract & Application Management,https://omnipress.com/guides/abstract-management-system-user-testing-checklist/,Guide,Informational,Abstract Management System User Testing Checklist,Abstract Management System User Testing Checklist,how abstract management works,download the Abstract Management System User Testing Checklist,,
Abstract & Application Management,https://omnipress.com/abstract-and-application-management/,Abstract & Application Management,https://omnipress.com/guides/abstract-management-tip-sheet/,Guide,Informational,Abstract Management Tips for a More Efficient Call for Abstracts,Abstract Management Tips for a More Efficient Call for Abstracts,how abstract management works,download the Abstract Management Tips for a More Efficient Call for Abstracts,,
Abstract & Application Management,https://omnipress.com/abstract-and-application-management/,Abstract & Application Management,https://omnipress.com/stories/abstract-management/,Stories Topic Hub,Commercial Investigation,abstract management customer stories,abstract management customer stories,case studies,how abstract management works,customer stories about Abstract & Application Management,
Abstract & Application Management,https://omnipress.com/abstract-and-application-management/,Abstract & Application Management,https://omnipress.com/videos/3-ways-catalyst-saves-you-time/,Video,Informational,3 ways catalyst abstract management system saves you time,3 ways catalyst abstract management system saves you time,how abstract management works,watch: 3 Ways CATALYST Abstract Management System Saves You Time,,
Abstract & Application Management,https://omnipress.com/abstract-and-application-management/,Abstract & Application Management,https://omnipress.com/videos/abstract-management-tip-1-collecting-everything-you-need-the-first-time/,Video,Informational,abstract management tip #1: collecting everything you need the first time,abstract management tip #1: collecting everything you need the first time,how abstract management works,watch: Abstract Management Tip #1: Collecting Everything You Need the First Time,,
Abstract & Application Management,https://omnipress.com/abstract-and-application-management/,Abstract & Application Management,https://omnipress.com/videos/abstract-management-tip-2-getting-better-submissions/,Video,Informational,abstract management tip #2: getting better submissions,abstract management tip #2: getting better submissions,how abstract management works,watch: Abstract Management Tip #2: Getting Better Submissions,,
Abstract & Application Management,https://omnipress.com/abstract-and-application-management/,Abstract & Application Management,https://omnipress.com/videos/abstract-management-tip-3-managing-deadlines/,Video,Informational,abstract management tip #3: managing deadlines,abstract management tip #3: managing deadlines,how abstract management works,watch: Abstract Management Tip #3: Managing Deadlines,,
Abstract & Application Management,https://omnipress.com/abstract-and-application-management/,Abstract & Application Management,https://omnipress.com/videos/abstract-management-tip-4-managing-reviewers/,Video,Informational,abstract management tip #4: managing reviewers,abstract management tip #4: managing reviewers,how abstract management works,watch: Abstract Management Tip #4: Managing Reviewers,,
Abstract & Application Management,https://omnipress.com/abstract-and-application-management/,Abstract & Application Management,https://omnipress.com/videos/catalyst-abstract-management-feature-focus-configurable-system/,Video,Informational,catalyst®: a fully configurable abstract management system,catalyst®: a fully configurable abstract management system,how abstract management works,watch: CATALYST®: A Fully Configurable Abstract Management System,,
Abstract & Application Management,https://omnipress.com/abstract-and-application-management/,Abstract & Application Management,https://omnipress.com/videos/catalyst-abstract-management-feature-focus-messaging-tool/,Video,Informational,catalyst’s built-in messaging tool keeps abstract communication organized,catalyst’s built-in messaging tool keeps abstract communication organized,how abstract management works,watch: CATALYST’s Built-In Messaging Tool Keeps Abstract Communication Organized,,
Abstract & Application Management,https://omnipress.com/abstract-and-application-management/,Abstract & Application Management,https://omnipress.com/videos/catalyst-abstract-management-feature-focus-project-managers/,Video,Informational,catalyst® provides personalized support from abstract management experts,catalyst® provides personalized support from abstract management experts,how abstract management works,watch: CATALYST® Provides Personalized Support from Abstract Management Experts,,
Abstract & Application Management,https://omnipress.com/abstract-and-application-management/,Abstract & Application Management,https://omnipress.com/videos/catalyst-abstract-management-feature-focus-scheduling-tool/,Video,Informational,easily schedule conference sessions with catalyst’s drag-and-drop tool,easily schedule conference sessions with catalyst’s drag-and-drop tool,how abstract management works,watch: Easily Schedule Conference Sessions with CATALYST’s Drag-and-Drop Tool,,
Abstract & Application Management,https://omnipress.com/abstract-and-application-management/,Abstract & Application Management,https://omnipress.com/videos/catalyst-abstract-management-feature-focus-user-dashboard/,Video,Informational,track abstract submissions & reviews in real time with catalyst®,track abstract submissions & reviews in real time with catalyst®,how abstract management works,watch: Track Abstract Submissions & Reviews in Real Time with CATALYST®,,
Abstract & Application Management,https://omnipress.com/abstract-and-application-management/,Abstract & Application Management,https://omnipress.com/videos/catalyst-abstract-management-system-quick-tour-video-by-omnipress/,Video,Informational,catalyst abstract management system quick tour video by omnipress,catalyst abstract management system quick tour video by omnipress,how abstract management works,watch: CATALYST Abstract Management System Quick Tour Video by Omnipress,,
Abstract & Application Management,https://omnipress.com/abstract-and-application-management/,Abstract & Application Management,https://omnipress.com/videos/omnipress-quick-demo-catalyst-abstract-management-platform-mobile-app-integration/,Video,Commercial Investigation,omnipress quick-demo: catalyst abstract management platform + mobile app integration,omnipress quick-demo: catalyst abstract management platform + mobile app integration,omnipress quick-demo: catalyst abstract management software + mobile app integration,how abstract management works,watch: Omnipress Quick-Demo: CATALYST abstract management platform + mobile app integration,
Abstract & Application Management,https://omnipress.com/abstract-and-application-management/,Abstract & Application Management,https://omnipress.com/webinars/30-min-demo-catalyst-and-mobile-app-integration/,Webinar,Commercial Investigation,30-Minute Demo,30-Minute Demo,how abstract management works,webinar: 30-Minute Demo,,
Application Management Software,https://omnipress.com/application-management/,,https://omnipress.com/application-management/,Product Hub,Commercial Investigation,application management software,application management software,awards management software,application management platform,tools for managing applications and reviews,our application management platform
Application Management Software,https://omnipress.com/application-management/,Application Management Software,https://omnipress.com/application-management/awards-management/,Product,Commercial Investigation,awards management software,awards management software,award nomination software,awards management platform,tools for managing applications and reviews,our awards management platform
Application Management Software,https://omnipress.com/application-management/,Application Management Software,https://omnipress.com/application-management/grants-management/,Product,Commercial Investigation,grants management software,grants management software,grant application software,grants management platform,tools for managing applications and reviews,our grants management platform
Application Management Software,https://omnipress.com/application-management/,Application Management Software,https://omnipress.com/application-management/scholarship-management/,Product,Commercial Investigation,scholarship management software,scholarship management software,scholarship application software,scholarship management platform,tools for managing applications and reviews,our scholarship management platform
Application Management Software,https://omnipress.com/application-management/,Application Management Software,https://omnipress.com/blog/application-management-software-buyers-guide/,Proposed PILLAR Blog,Informational,application management software buyer's guide,application management software buyer's guide,awards management software,application management platform buyer's guide,tools for managing applications and reviews,our application management buyer's guide platform
Application Management Software,https://omnipress.com/application-management/,Application Management Software,https://omnipress.com/blog/awards-program-content-engages-members-year-round/,Blog Post,Informational,awards program content strategy,awards program content strategy,abstract management,tools for managing applications and reviews,see how Omnipress supports awards program content strategy,
Conferences,https://omnipress.com/conferences/,,https://omnipress.com/conferences/,Main Service,Commercial Investigation,conference printing and event technology,conference printing and event technology,conference content management,how conference printing runs smoothly,see how Omnipress supports conference printing and event technology,
Conferences,https://omnipress.com/conferences/,Conferences,https://omnipress.com/blog/4-takeaways-from-the-omnipress-2023-conference-industry-report/,Blog Post,Informational,2023 conference industry report,2023 conference industry report,how 2023 conference industry report works,see how Omnipress supports 2023 conference industry report,,
Conferences,https://omnipress.com/conferences/,Conferences,https://omnipress.com/blog/association-profile-aota-building-strong-relationships-young-professionals/,Blog Post,Informational,engaging young professionals,engaging young professionals,young professionals,how engaging young professionals works,see how Omnipress supports engaging young professionals,
Conferences,https://omnipress.com/conferences/,Conferences,https://omnipress.com/blog/conference-content-delivery-playbook/,Proposed PILLAR Blog,Informational,conference content delivery,conference content delivery,conference content strategy,how conference content delivery works,see how Omnipress supports conference content delivery,
Conferences,https://omnipress.com/conferences/,Conferences,https://omnipress.com/blog/designing-for-neurodiversity-how-to-make-your-in-person-education-events-neuro-inclusive/,Blog Post,Informational,neuroinclusive education events,neuroinclusive education events,and training manuals,how neuroinclusive education events works,see how Omnipress supports neuroinclusive education events,
Conferences,https://omnipress.com/conferences/,Conferences,https://omnipress.com/blog/how-to-avoid-last-minute-printing-problems-for-your-event-or-conference/,Blog Post,Informational,conference printing timeline,conference printing timeline,conference materials printing,how conference printing runs smoothly,see how Omnipress supports conference printing timeline,
Conferences,https://omnipress.com/conferences/,Conferences,https://omnipress.com/blog/tips-for-designing-an-inspiring-conference-program-booklet/,Blog Post,Informational,conference program book design,conference program book design,conference printing 2,how conference program book design works,see how Omnipress supports conference program book design,
Conferences,https://omnipress.com/conferences/,Conferences,https://omnipress.com/blog/use-your-conference-program-book-to-increase-learning-engagement-and-revenue/,Blog Post,Informational,conference program book ideas,conference program book ideas,conference content,how conference program book ideas works,see how Omnipress supports conference program book ideas,
Conferences,https://omnipress.com/conferences/,Conferences,https://omnipress.com/conferences/conference-printing/,Service,Commercial Investigation,conference printing services,conference printing services,conference program booklet printing,conference printing,how conference printing runs smoothly,see how Omnipress supports conference printing
Conferences,https://omnipress.com/conferences/,Conferences,https://omnipress.com/conferences/event-services/,Service,Commercial Investigation,event services,event services,event technology services,event,how event works,see how Omnipress supports event
Conferences,https://omnipress.com/conferences/,Conferences,https://omnipress.com/customers/obesity-medicine-association/,Customer Story,Commercial Investigation,conference printing case study,conference printing case study,how conference printing runs smoothly,see how Obesity Medicine Association improved their conference content delivery,,
Conferences,https://omnipress.com/conferences/,Conferences,https://omnipress.com/faqs/can-you-help-me-with-other-conference-materials-such-as-sponsor-pieces-and-swag-bags/,FAQ,Informational,event swag bag assembly,event swag bag assembly,conference swag bags,how event swag bag assembly works,FAQ: Conferences,
Conferences,https://omnipress.com/conferences/,Conferences,https://omnipress.com/guides/perfectly-practical-conference-recipes/,Guide,Informational,Recipes for a Perfectly Practical Conference:,Recipes for a Perfectly Practical Conference:,how Recipes for a Perfectly Practical Conference: works,download the Recipes for a Perfectly Practical Conference:,,
Conferences,https://omnipress.com/conferences/,Conferences,https://omnipress.com/reports/2022-conference-industry-report/,Report,Informational,2022 Conference Industry Report,2022 Conference Industry Report,industry report,how 2022 Conference Industry Report works,read the 2022 Conference Industry Report,
Conferences,https://omnipress.com/conferences/,Conferences,https://omnipress.com/reports/2023-conference-industry-report/,Report,Informational,2023 Conference Industry Report,2023 Conference Industry Report,industry report,how 2023 Conference Industry Report works,read the 2023 Conference Industry Report,
Conferences,https://omnipress.com/conferences/,Conferences,https://omnipress.com/stories/conferences/,Stories Topic Hub,Commercial Investigation,conference customer stories,conference customer stories,case studies,how conference customer stories works,customer stories about Conferences,
Conferences,https://omnipress.com/conferences/,Conferences,https://omnipress.com/webinars/2023-conference-industry-report-takeaways-panel/,Webinar,Informational,On-Demand Panel Discussion: What’s (Really) on the Event Horizon?,On-Demand Panel Discussion: What’s (Really) on the Event Horizon?,how On-Demand Panel Discussion: What’s (Really) on the Event Horizon? works,webinar: On-Demand Panel Discussion: What’s (Really) on the Event Horizon?,,
Conferences,https://omnipress.com/conferences/,Conferences,https://omnipress.com/webinars/designing-in-person-neuro-inclusive-education-events/,Webinar,Informational,Panel Discussion: Designing In-Person Education Events That Are Neuro-Inclusive,Panel Discussion: Designing In-Person Education Events That Are Neuro-Inclusive,how Panel Discussion: Designing In-Person Education Events That Are Neuro-Inclusive works,webinar: Panel Discussion: Designing In-Person Education Events That Are Neuro-Inclusive,,
Digital Products,https://omnipress.com/digital-products/,,https://omnipress.com/digital-products/,Product Hub,Commercial Investigation,digital event and publication solutions,digital event and publication solutions,digital event solutions,how associations deliver member publications,see how Omnipress supports digital event and publication,
Digital Products,https://omnipress.com/digital-products/,Digital Products,https://omnipress.com/blog/5-reasons-to-offer-online-conference-materials-even-if-you-already-have-an-app/,Blog Post,Informational,online conference materials,online conference materials,conference content,how online conference materials works,see how Omnipress supports online conference materials,
Digital Products,https://omnipress.com/digital-products/,Digital Products,https://omnipress.com/blog/digital-event-publication-platform-guide/,Proposed PILLAR Blog,Informational,digital event and publication platform,digital event and publication platform,digital publications platform,digital event and publication software,how associations deliver member publications,our digital event and publication platform
