Keyword,Search Volume,Search Intent,Topic Cluster,Current URL,Match Type,Suggested Action,Notes
nonprofit fundraising strategies,1900,Informational,Fundraising,/ultimate-guide-to-nonprofit-fundraising,Exact,None,"Pillar page, already optimized"
nonprofit email marketing,1000,Transactional,Fundraising,/email-marketing-guide,Partial,Optimize,Add section on email for nonprofits
grant writing for nonprofits,720,Informational,Grants & Funding,,None,Create New,No content exists—priority for Q3
how to start a nonprofit,2400,Informational,Starting a Nonprofit,/start-a-nonprofit-checklist,Exact,None,Top of funnel resource
nonprofit social media tips,880,Informational,Marketing,,None,Create New,Opportunity to target long-tail keywords