Page,Analysis,Why/Recommendation,Next Steps
Performance Windows,"Strongest service page across all data sources. Stable clicks in GSC, high impressions, massive YoY organic growth, and the highest Request-a-Quote increase. Clarity shows heavy interaction with REQUEST A QUOTE but limited scroll depth and dead/rage clicks.","This is the flagship service page and primary revenue driver. High traffic and lead growth indicate strong market fit, but UX friction and above-the-fold dependency limit full conversion potential.","Content Refresh, Technical Assessment, Internal Linking"
Advanced Composites,"Growing clicks and impressions, strong YoY engagement growth, but low lead output. Clarity shows frequent dead clicks on non-interactive text and users navigating away to other services.","Users show interest, but the page is acting more as a pass-through than a decision or conversion page. UX clarity and service positioning need improvement.","Content Refresh, Internal Linking, Technical Assessment"
Thermoformed Plastics,"Most critical decline: large drops in impressions and clicks, extremely low CTR, and weak SERP visibility. Clarity indicates confusion and frustration clicks.",This page has likely lost rankings and relevance. It requires both SEO realignment and UX correction to recover visibility and intent match.,"Fundamentals, Content Refresh, Technical Assessment, Internal Linking"
Engineering & Design,"Minimal organic visibility, low engagement, and no lead contribution. Clarity shows users primarily click out to other services rather than engage.",This page is not positioned as a demand driver. It should function as a technical authority and support page that strengthens other services.,"Content Refresh, Internal Linking"
Coatings Group,"Stable GSC performance with strong CTR and major YoY organic growth, but low absolute conversions. Clarity shows steep mobile drop-off and heavy above-the-fold reliance.","There is clear interest, but layout and conversion structure are limiting lead capture, especially on mobile.","Content Refresh, Fundamentals, Technical Assessment"