"Address","Content Type","Status Code","Status","Indexability","Indexability Status","Title 1","Meta Description 1","H1-1","Title 1 Length","Title 1 Pixel Width","Meta Description 1 Length","Meta Description 1 Pixel Width","Meta Keywords 1","Meta Keywords 1 Length","H1-1 Length","H2-1","H2-1 Length","H2-2","H2-2 Length","Meta Robots 1","X-Robots-Tag 1","Meta Refresh 1","Canonical Link Element 1","rel=""next"" 1","rel=""prev"" 1","HTTP rel=""next"" 1","HTTP rel=""prev"" 1","amphtml Link Element","Size (bytes)","Transferred (bytes)","Total Transferred (bytes)","CO2 (mg)","Carbon Rating","Word Count","Sentence Count","Average Words Per Sentence","Flesch Reading Ease Score","Readability","Text Ratio","Crawl Depth","Folder Depth","Link Score","Inlinks","Unique Inlinks","Unique JS Inlinks","% of Total","Outlinks","Unique Outlinks","Unique JS Outlinks","External Outlinks","Unique External Outlinks","Unique External JS Outlinks","Closest Near Duplicate Match","No. Near Duplicates","Spelling Errors","Grammar Errors","Hash","Response Time","Last Modified","Redirect URL","Redirect Type","Cookies","Language","HTTP Version","Performance Score","First Contentful Paint Time (ms)","Speed Index Time (ms)","Largest Contentful Paint Time (ms)","Time to Interactive (ms)","Total Blocking Time (ms)","Cumulative Layout Shift","Total Size Savings (Bytes)","Total Time Savings (ms)","Total Requests","Total Page Size (Bytes)","HTML Size (Bytes)","HTML Count","Image Size (Bytes)","Image Count","CSS Size (Bytes)","CSS Count","JavaScript Size (Bytes)","JavaScript Count","Font Size (Bytes)","Font Count","Media Size (Bytes)","Media Count","Other Size (Bytes)","Other Count","Third Party Size (Bytes)","Third Party Count","Core Web Vitals Assessment","CrUX Largest Contentful Paint Time (ms)","CrUX Interaction to Next Paint (ms)","CrUX Cumulative Layout Shift","CrUX First Contentful Paint Time (ms)","Minify CSS Savings (ms)","Minify CSS Savings (Bytes)","Minify JavaScript Savings (ms)","Minify JavaScript Savings (Bytes)","Reduce Unused CSS Savings (ms)","Reduce Unused CSS Savings (Bytes)","Reduce Unused JavaScript Savings (ms)","Reduce Unused JavaScript Savings (Bytes)","JavaScript Execution Time (ms)","JavaScript Execution Time Category","Minimize Main-Thread Work (ms)","Minimize Main-Thread Work Category","Network Payload Size (Bytes)","User Timing Marks and Measures","Number of Redirects","Server Responds Quickly","Applies Text Compression","LCP Request Discovery","LCP Breakdown","Render Blocking Requests Savings (ms)","Preconnect Candidates Savings (ms)","Maximum Critical Path Latency (ms)","Use Efficient Cache Lifetimes Savings (Bytes)","Layout Shift Culprits","DOM Size","Improve Image Delivery Savings (Bytes)","Forced Reflow Savings (ms)","Legacy JavaScript Savings (Bytes)","Duplicated JavaScript (Bytes)","Font Display Savings (ms)","3rd Parties","Target Size","Content Width","Font Display Size","Viewport","Mobile Alternate Link","Closest Semantically Similar Address","Semantic Similarity Score","No. Semantically Similar","Semantic Relevance Score","URL Encoded Address","Crawl Timestamp"
"https://lawlancaster.com/","text/html; charset=UTF-8","200","OK","Indexable","","Criminal Defense & Divorce Attorneys in Lancaster, PA | Lawyer Near Me","Lancaster Law Group provides criminal defense and divorce attorney services. Contact us now for dedicated and effective legal support!","A Firm Commitment To Trust","70","644","134","840","","0","26","Welcome to Lancaster Law Group","30","Schedule a Consultation","23","index, follow, max-image-preview:large, max-snippet:-1, max-video-preview:-1","","","https://lawlancaster.com/","","","","","","680132","90266","90266","34.579","","972","152","6.395","67.091","Normal","1.345","0","0","","982","137","0","100.000","146","39","0","5","5","0","","","","","c5fda5fc18bde819b6223d6e3b856429","0.755","Mon, 02 Feb 2026 17:10:59 GMT","","","","en-US","1.1","97","1243.000","3921.413","1259.500","1553.100","26.000","0.066","100492","0","20","1124108","94745","2","837361","11","8121","1","0","0","183881","6","0","0","0","0","5440","11","","","","","","0","0","0","0","0","100492","0","0","63.654","Good","913.436","Good","1118668","0","Avoids redirects","Server responds quickly (observed 187 ms)","Applies text compression","","2 resources found","0","","1159","0","1 resource found","1199","99577","78","0","","0","","100","","","100","","","","","","https://lawlancaster.com/","2026-02-03 21:38:20"
"https://lawlancaster.com/62708-2/","text/html; charset=UTF-8","200","OK","Indexable","","CRIMINAL ACT IN 1993 RESULTS IN VICTIM'S DEATH IN 2007 ... WHAT SENTENCING LAW APPLIES? | Lawlancaster","In the recent decision of Commonwealth v. Rose, No. 26 WAP 2014 (November 18, 2015), the PA Supreme Court has held that where a crime requires both a","CRIMINAL ACT IN 1993 RESULTS IN VICTIM’S DEATH IN 2007 … WHAT SENTENCING LAW APPLIES?","102","1025","149","958","","0","85","Related Posts","13","Quick Links","11","index, follow, max-image-preview:large, max-snippet:-1, max-video-preview:-1","","","https://lawlancaster.com/62708-2/","","","","","","485968","72381","72381","27.728","","1388","196","7.082","72.442","Fairly Easy","2.685","3","1","","7","3","0","2.190","135","46","0","6","6","0","","","","","c20cbb88af3e8bdb60c1386ba6a62b33","0.715","Thu, 29 Jan 2026 12:27:50 GMT","","","","en-US","1.1","100","1097.000","1097.000","1112.000","1113.500","0.000","0.001","19094","0","11","220458","72738","1","7380","4","5259","1","0","0","135081","5","0","0","0","0","0","4","","","","","","0","0","0","0","0","19094","0","0","43.502","Good","414.286","Good","220458","0","Avoids redirects","Server responds quickly (observed 17 ms)","Applies text compression","","2 resources found","0","","265","0","1 resource found","962","0","78","0","","0","","100","","","100","","","","","","https://lawlancaster.com/62708-2/","2026-02-03 21:41:12"
"https://lawlancaster.com/62845-2/","text/html; charset=UTF-8","200","OK","Indexable","","PA SUPREME COURT: STATUTE ALLOWING EXPERT WITNESS TESTIMONY REGARDING VICTIM RESPONSES & BEHAVIORS IS NOT UNCONSTITUTIONAL | Lawlancaster","The PA Supreme Court has decided, in the case of Commonwealth v. Olivo, No. 127 MAP 2014 (November 18, 2015), that it was improper for the trial court to","PA SUPREME COURT: STATUTE ALLOWING EXPERT WITNESS TESTIMONY REGARDING VICTIM RESPONSES & BEHAVIORS IS NOT UNCONSTITUTIONAL","137","1494","153","966","","0","122","Related Posts","13","Quick Links","11","index, follow, max-image-preview:large, max-snippet:-1, max-video-preview:-1","","","https://lawlancaster.com/62845-2/","","","","","","481013","70563","70563","27.031","","1027","159","6.459","57.851","Fairly Hard","2.277","3","1","","7","3","0","2.190","135","46","0","6","6","0","","","","","9dbb8cd239dddab82cec5b8e2bbe53e3","0.600","Thu, 29 Jan 2026 10:31:55 GMT","","","","en-US","1.1","100","1080.000","1143.490","1107.500","1110.250","0.000","0.001","18807","0","11","218640","70920","1","7380","4","5259","1","0","0","135081","5","0","0","0","0","0","4","","","","","","0","0","0","0","0","18807","0","0","43.061","Good","502.008","Good","218640","0","Avoids redirects","Server responds quickly (observed 21 ms)","Applies text compression","","2 resources found","0","","291","0","1 resource found","930","0","81","0","","0","","100","","","100","","","","","","https://lawlancaster.com/62845-2/","2026-02-03 21:41:16"
"https://lawlancaster.com/62908-2/","text/html; charset=UTF-8","200","OK","Indexable","","MERE POSSESSION OF A STOLEN HANDGUN IS INSUFFICIENT TO SUPPORT CONVICTION FOR RECEIVING STOLEN PROPERTY | Lawlancaster","The Pa. Superior Court has vacated Defendant’s conviction of Receiving Stolen Property in the case of Commonwealth v. Robinson, No. 912 MDA 2014 (November","MERE POSSESSION OF A STOLEN HANDGUN IS INSUFFICIENT TO SUPPORT CONVICTION FOR RECEIVING STOLEN PROPERTY","118","1265","154","999","","0","103","Related Posts","13","Quick Links","11","index, follow, max-image-preview:large, max-snippet:-1, max-video-preview:-1","","","https://lawlancaster.com/62908-2/","","","","","","484604","71835","71835","27.519","","1182","174","6.793","65.453","Normal","2.446","3","1","","7","3","0","2.190","135","46","0","6","6","0","","","","","cf82aa827e675dc30e4d5f71a61849c3","0.645","Thu, 29 Jan 2026 20:18:14 GMT","","","","en-US","1.1","100","1080.000","1096.784","1092.500","1093.750","0.000","0.036","19003","0","15","339614","72192","1","7380","4","5265","1","0","0","254777","9","0","0","0","0","0","5","","","","","","0","0","0","0","0","19003","0","0","34.175","Good","403.295","Good","339614","0","Avoids redirects","Server responds quickly (observed 15 ms)","Applies text compression","","2 resources found","0","","282","0","2 resources found","933","0","0","0","","0","","100","","","100","","","","","","https://lawlancaster.com/62908-2/","2026-02-03 21:41:22"
"https://lawlancaster.com/64137-2/","text/html; charset=UTF-8","200","OK","Indexable","","POLICE DO NOT NEED A WARRANT TO SEARCH OR SEIZE YOUR VEHICLE FROM YOUR OWN DRIVEWAY | Lawlancaster","In a matter of first impression, the PA Superior Court has decided the case of Commonwealth v. Loughnane, No. 596 MDA 2014 (November 23, 2015), holding","POLICE DO NOT NEED A WARRANT TO SEARCH OR SEIZE YOUR VEHICLE FROM YOUR OWN DRIVEWAY","98","1055","151","970","","0","83","Related Posts","13","Quick Links","11","index, follow, max-image-preview:large, max-snippet:-1, max-video-preview:-1","","","https://lawlancaster.com/64137-2/","","","","","","483316","71456","71456","27.373","","1010","166","6.084","68.315","Normal","2.163","3","1","","7","3","0","2.190","135","46","0","6","6","0","","","","","6ae6584e3650f8c2811ab46cf03e9b42","0.650","Thu, 29 Jan 2026 20:12:14 GMT","","","","en-US","1.1","100","1107.000","1107.000","1117.000","1118.000","0.000","0.000","18953","0","11","219539","71813","1","7380","4","5265","1","0","0","135081","5","0","0","0","0","0","4","","","","","","0","0","0","0","0","18953","0","0","36.227","Good","389.080","Good","219539","0","Avoids redirects","Server responds quickly (observed 15 ms)","Applies text compression","","2 resources found","0","","268","0","1 resource found","939","0","57","0","","0","","100","","","100","","","","","","https://lawlancaster.com/64137-2/","2026-02-03 21:41:15"
"https://lawlancaster.com/66612-2/","text/html; charset=UTF-8","200","OK","Indexable","","DAUGHTER'S DORM IS NOT A ""PLACE FOR EMERGENCY MEDICAL TREATMENT"" : Violation of OLL results in 60 day jail sentence. | Lawlancaster","The PA Superior Court has decided the case of Commonwealth v. Kriegler, 62 MDA 2015 (December 1, 2015), holding that it is entirely appropriate for police","DAUGHTER’S DORM IS NOT A “PLACE FOR EMERGENCY MEDICAL TREATMENT” : Violation of OLL results in 60 day jail sentence.","131","1276","154","954","","0","116","Related Posts","13","Quick Links","11","index, follow, max-image-preview:large, max-snippet:-1, max-video-preview:-1","","","https://lawlancaster.com/66612-2/","","","","","","485097","72266","72266","27.684","","1215","176","6.903","66.905","Normal","2.457","3","1","","7","3","0","2.190","135","46","0","6","6","0","","","","","7a9b1f8545dabfdffedd93a05d28d233","0.790","Thu, 29 Jan 2026 14:32:13 GMT","","","","en-US","1.1","100","1106.000","1106.000","1116.000","1117.000","0.000","0.001","19098","0","11","220343","72623","1","7380","4","5259","1","0","0","135081","5","0","0","0","0","0","4","","","","","","0","0","0","0","0","19098","0","0","28.188","Good","337.133","Good","220343","0","Avoids redirects","Server responds quickly (observed 17 ms)","Applies text compression","","2 resources found","0","","272","0","1 resource found","943","0","0","0","","0","","100","","","100","","","","","","https://lawlancaster.com/66612-2/","2026-02-03 21:41:14"
"https://lawlancaster.com/67853-2/","text/html; charset=UTF-8","200","OK","Indexable","","TWO CONVICTIONS OF THE SAME FIREARM VIOLATION AT SAME TRIAL TRIGGER FIVE YEAR MANDATORY MINIMUM SENTENCE | Lawlancaster","The PA Superior Court has held in the case of Commonwealth v. Dawson, No. 3498 EDA 2014 (December 8, 2015) that a person convicted at the same trial of","TWO CONVICTIONS OF THE SAME FIREARM VIOLATION AT SAME TRIAL TRIGGER FIVE YEAR MANDATORY MINIMUM SENTENCE","119","1285","151","966","","0","104","Related Posts","13","Quick Links","11","index, follow, max-image-preview:large, max-snippet:-1, max-video-preview:-1","","","https://lawlancaster.com/67853-2/","","","","","","484097","71761","71761","27.490","","1126","168","6.702","77.565","Fairly Easy","2.288","3","1","","7","3","0","2.190","135","46","0","6","6","0","","","","","8f352377154a5a74ed568f4e69386aba","0.692","Thu, 29 Jan 2026 11:59:51 GMT","","","","en-US","1.1","100","1097.000","1097.000","1109.000","1110.200","0.000","0.000","19004","0","11","219838","72118","1","7380","4","5259","1","0","0","135081","5","0","0","0","0","0","4","","","","","","0","0","0","0","0","19004","0","0","32.677","Good","334.910","Good","219838","0","Avoids redirects","Server responds quickly (observed 17 ms)","Applies text compression","","2 resources found","0","","269","0","1 resource found","936","0","57","0","","0","","100","","","100","","","","","","https://lawlancaster.com/67853-2/","2026-02-03 21:41:08"
"https://lawlancaster.com/68289-2/","text/html; charset=UTF-8","200","OK","Indexable","","NEW LEGAL CHANGES TO AFFECT PA CDL LICENSE AND PERMIT HOLDERS | Lawlancaster","NEW COMMERCIAL DRIVER SKILLS TESTS PennDOT has begun phasing in a new Commercial Driver Skills Test (CDST) as required by the Federal Motor Carrier","NEW LEGAL CHANGES TO AFFECT PA CDL LICENSE AND PERMIT HOLDERS","76","813","147","977","","0","61","Related Posts","13","Quick Links","11","index, follow, max-image-preview:large, max-snippet:-1, max-video-preview:-1","","","https://lawlancaster.com/68289-2/","","","","","","477902","69440","69440","26.601","","230","64","3.594","84.380","Easy","0.995","3","1","","7","3","0","2.190","135","46","0","6","6","0","","","","","c3855343dc32d2c7b26f3423fccdd02e","0.631","Thu, 29 Jan 2026 11:09:49 GMT","","","","en-US","1.1","100","1067.000","1067.000","1080.000","1081.300","0.000","0.001","18627","0","14","337213","69797","1","7380","4","5259","1","0","0","254777","8","0","0","0","0","0","4","","","","","","0","0","0","0","0","18627","0","0","25.502","Good","273.661","Good","337213","0","Avoids redirects","Server responds quickly (observed 17 ms)","Applies text compression","","2 resources found","0","","259","0","2 resources found","908","0","0","0","","0","","100","","","100","","","","","","https://lawlancaster.com/68289-2/","2026-02-03 21:41:22"
"https://lawlancaster.com/68915-2/","text/html; charset=UTF-8","200","OK","Indexable","","ANONYMOUS TIP FROM UNRELIABLE, UNCORROBORATED SOURCE THAT PAROLEE IS DEALING DRUGS IS INSUFFICIENT TO JUSTIFY SEARCH OF RESIDENCE | Lawlancaster","The Pa. Superior Court has decided the case of Com. v. Coleman, M. No. 1839 WDA 2014 (December 14, 2015), holding that an unreliable, uncorroborated,","ANONYMOUS TIP FROM UNRELIABLE, UNCORROBORATED SOURCE THAT PAROLEE IS DEALING DRUGS IS INSUFFICIENT TO JUSTIFY SEARCH OF RESIDENCE","144","1543","149","948","","0","129","Related Posts","13","Quick Links","11","index, follow, max-image-preview:large, max-snippet:-1, max-video-preview:-1","","","https://lawlancaster.com/68915-2/","","","","","","485512","72183","72183","27.652","","1272","192","6.625","57.448","Fairly Hard","2.590","3","1","","7","3","0","2.190","135","46","0","6","6","0","","","","","3154782b79f3ba98b8a6bf7306cb9970","0.679","Thu, 29 Jan 2026 13:41:25 GMT","","","","en-US","1.1","100","1078.000","1147.943","1101.000","1103.300","0.000","0.020","19060","0","11","220260","72540","1","7380","4","5259","1","0","0","135081","5","0","0","0","0","0","4","","","","","","0","0","0","0","0","19060","0","0","39.680","Good","469.810","Good","220260","0","Avoids redirects","Server responds quickly (observed 19 ms)","Applies text compression","","2 resources found","0","","276","0","1 resource found","934","0","128","0","","0","","100","","","100","","","","","","https://lawlancaster.com/68915-2/","2026-02-03 21:41:08"
"https://lawlancaster.com/68936-2/","text/html; charset=UTF-8","200","OK","Indexable","","IN ORDER TO FLEE FROM APPREHENSION, TRIAL or PUNISHMENT, YOU MUST FIRST BE CHARGED or CONVICTED | Lawlancaster","In a matter of first impression, the Pa. Superior Court has decided the case of Commonwealth v. Phillips, A., No. 1427 WDA 2014 (December 14, 2015),","IN ORDER TO FLEE FROM APPREHENSION, TRIAL or PUNISHMENT, YOU MUST FIRST BE CHARGED or CONVICTED","110","1149","148","922","","0","95","Related Posts","13","Quick Links","11","index, follow, max-image-preview:large, max-snippet:-1, max-video-preview:-1","","","https://lawlancaster.com/68936-2/","","","","","","482910","71326","71326","27.324","","918","144","6.375","71.160","Fairly Easy","2.030","3","1","","7","3","0","2.190","135","46","0","6","6","0","","","","","5c43c4857ff4bc7322bfcdd68747df9d","0.637","Thu, 29 Jan 2026 06:38:39 GMT","","","","en-US","1.1","100","1072.000","1089.359","1090.000","1091.800","0.000","0.000","18935","0","11","219403","71683","1","7380","4","5259","1","0","0","135081","5","0","0","0","0","0","4","","","","","","0","0","0","0","0","18935","0","0","35.372","Good","360.142","Good","219403","0","Avoids redirects","Server responds quickly (observed 18 ms)","Applies text compression","","2 resources found","0","","277","0","1 resource found","935","0","92","0","","0","","100","","","100","","","","","","https://lawlancaster.com/68936-2/","2026-02-03 21:41:10"
"https://lawlancaster.com/70967-2/","text/html; charset=UTF-8","200","OK","Indexable","","COURT UPHOLDS SUPPRESSION OF EVIDENCE: OFFICERS TESTIFIED TO FACTS THAT WERE INCONSISTENT WITH OR OMITTED FROM THE POLICE REPORT | Lawlancaster","The PA Superior Court has decided the case of Commonwealth v. Shabezz, No. 1639 EDA 2014 (December 21, 2015), holding that the trial court properly","COURT UPHOLDS SUPPRESSION OF EVIDENCE: OFFICERS TESTIFIED TO FACTS THAT WERE INCONSISTENT WITH OR OMITTED FROM THE POLICE REPORT","143","1531","147","937","","0","128","Related Posts","13","Quick Links","11","index, follow, max-image-preview:large, max-snippet:-1, max-video-preview:-1","","","https://lawlancaster.com/70967-2/","","","","","","485620","72352","72352","27.717","","1320","185","7.135","70.770","Fairly Easy","2.619","3","1","","7","3","0","2.190","135","46","0","6","6","0","","","","","4b2d66703216ad4cb5047a8a6498d2e","0.660","Thu, 29 Jan 2026 12:43:01 GMT","","","","en-US","1.1","94","2401.000","2900.455","2476.000","2483.500","0.000","0.024","19100","0","11","220429","72709","1","7380","4","5259","1","0","0","135081","5","0","0","0","0","0","4","","","","","","0","0","0","0","0","19100","0","0","36.343","Good","333.612","Good","220429","0","Avoids redirects","Server responds quickly (observed 17 ms)","Applies text compression","","2 resources found","0","","267","0","1 resource found","934","0","0","0","","0","","100","","","100","","","","","","https://lawlancaster.com/70967-2/","2026-02-03 21:41:22"
"https://lawlancaster.com/71087-2/","text/html; charset=UTF-8","200","OK","Indexable","","JUVENILE ADJUDICATION OF DELINQUENCY IS NOT A CONVICTION FOR THE PURPOSE OF ENHANCING THE GRADING OF A VIOLATION OF THE PA UNIFORM FIREARMS ACT | Lawlancaster","The PA Supreme Court has held in the case of Commonwealth v. Hale, 25 EAP 2014 (December 21, 2015) that juvenile adjudications of delinquency are not","JUVENILE ADJUDICATION OF DELINQUENCY IS NOT A CONVICTION FOR THE PURPOSE OF ENHANCING THE GRADING OF A VIOLATION OF THE PA UNIFORM FIREARMS ACT","158","1686","149","950","","0","143","Related Posts","13","Quick Links","11","index, follow, max-image-preview:large, max-snippet:-1, max-video-preview:-1","","","https://lawlancaster.com/71087-2/","","","","","","484474","71873","71873","27.533","","1040","165","6.303","56.455","Fairly Hard","2.306","3","1","","7","3","0","2.190","135","46","0","6","6","0","","","","","c79857a1f16cc7fe3bde847d1f4185f0","0.693","Thu, 29 Jan 2026 11:46:19 GMT","","","","en-US","1.1","100","1103.000","1103.000","1113.500","1114.550","0.000","0.001","19019","0","11","219950","72230","1","7380","4","5259","1","0","0","135081","5","0","0","0","0","0","4","","","","","","0","0","0","0","0","19019","0","0","28.596","Good","315.524","Good","219950","0","Avoids redirects","Server responds quickly (observed 18 ms)","Applies text compression","","2 resources found","0","","274","0","2 resources found","939","0","0","0","","0","","100","","","100","","","","","","https://lawlancaster.com/71087-2/","2026-02-03 21:41:23"
"https://lawlancaster.com/71194-2/","text/html; charset=UTF-8","200","OK","Indexable","","IF YOU'RE INVOLVED IN A HOMICIDE, DON'T UPLOAD A RAP VIDEO TO YOU TUBE SUGGESTING YOU MIGHT HAVE DONE IT - McMahon Winters","The PA Superior Court has decided the case of Commonwealth v. Talbert, No. 719 EDA 2015 (December 22, 2015), holding that it was not improper for the","IF YOU’RE INVOLVED IN A HOMICIDE, DON’T UPLOAD A RAP VIDEO TO YouTube SUGGESTING YOU MIGHT HAVE DONE IT","122","1271","149","947","","0","103","Related Posts","13","Quick Links","11","index, follow, max-image-preview:large, max-snippet:-1, max-video-preview:-1","","","https://lawlancaster.com/71194-2/","","","","","","485475","72393","72393","27.732","","1356","188","7.213","75.484","Fairly Easy","2.591","3","1","","7","3","0","2.190","135","46","0","6","6","0","","","","","56ac6896a7b966bb36c0b45ad59f0ad8","0.600","Thu, 29 Jan 2026 09:25:52 GMT","","","","en-US","1.1","100","1072.000","1072.000","1088.500","1090.150","0.000","0.000","19117","0","14","340166","72750","1","7380","4","5259","1","0","0","254777","8","0","0","0","0","0","4","","","","","","0","0","0","0","0","19117","0","0","24.684","Good","330.887","Good","340166","0","Avoids redirects","Server responds quickly (observed 17 ms)","Applies text compression","","2 resources found","0","","256","0","1 resource found","939","0","0","0","","0","","100","","","100","","","","","","https://lawlancaster.com/71194-2/","2026-02-03 21:41:20"
"https://lawlancaster.com/71300-2/","text/html; charset=UTF-8","200","OK","Indexable","","AGGRAVATED ASSAULT & RECKLESSLY ENDANGERING ANOTHER PERSON DO NOT MERGE FOR SENTENCING PURPOSES | Lawlancaster","The PA Superior Court has decided the case of Commonwealth v. Cianci, No. 3459 EDA 2014 (December 23, 2015), holding that the offenses of Recklessly","AGGRAVATED ASSAULT & RECKLESSLY ENDANGERING ANOTHER PERSON DO NOT MERGE FOR SENTENCING PURPOSES","110","1229","148","945","","0","95","Related Posts","13","Quick Links","11","index, follow, max-image-preview:large, max-snippet:-1, max-video-preview:-1","","","https://lawlancaster.com/71300-2/","","","","","","483223","71295","71295","27.312","","922","150","6.147","56.996","Fairly Hard","2.103","3","1","","7","3","0","2.190","135","46","0","6","6","0","","","","","5e3422792311174f1528f174568f07cd","0.652","Thu, 29 Jan 2026 08:34:55 GMT","","","","en-US","1.1","100","1101.000","1101.000","1104.000","1104.300","0.000","0.002","18915","0","14","339068","71652","1","7380","4","5259","1","0","0","254777","8","0","0","0","0","0","4","","","","","","0","0","0","0","0","18915","0","0","24.786","Good","264.504","Good","339068","0","Avoids redirects","Server responds quickly (observed 18 ms)","Applies text compression","","2 resources found","0","","254","0","2 resources found","936","0","0","0","","0","","100","","","100","","","","","","https://lawlancaster.com/71300-2/","2026-02-03 21:41:21"
"https://lawlancaster.com/73174-2/","text/html; charset=UTF-8","200","OK","Indexable","","PA SUPREME COURT HOLDS THAT ANY RESPONSE OTHER THAN “Yes, where do I blow?” “Yes, which arm do you want to stick?” or “Yes, where do you want me to pee?” CAN BE DEEMED A REFUSAL TO SUBMIT TO CHEMICAL TESTING | Lawlancaster","The PA Supreme Court recently decided the case of Nardone v. Dept. of Transportation, 141 MAP 2014 (December 29, 2015), addressing conflicting","PA SUPREME COURT HOLDS THAT ANY RESPONSE OTHER THAN “Yes, where do I blow?” “Yes, which arm do you want to stick?” or “Yes, where do you want me to pee?” CAN BE DEEMED A REFUSAL TO SUBMIT TO CHEMICAL TESTING","222","2217","142","907","","0","207","Related Posts","13","Quick Links","11","index, follow, max-image-preview:large, max-snippet:-1, max-video-preview:-1","","","https://lawlancaster.com/73174-2/","","","","","","490282","73688","73688","28.228","","1933","248","7.794","67.494","Normal","3.456","3","1","","7","3","0","2.190","135","46","0","6","6","0","","","","","8fd5e9c3835bc3c19f0716e84a047be6","0.651","Thu, 29 Jan 2026 14:51:14 GMT","","","","en-US","1.1","100","1069.000","1069.000","1093.000","1095.400","0.000","0.002","19269","0","14","341461","74045","1","7380","4","5259","1","0","0","254777","8","0","0","0","0","0","4","","","","","","0","0","0","0","0","19269","0","0","32.026","Good","357.190","Good","341461","0","Avoids redirects","Server responds quickly (observed 20 ms)","Applies text compression","","2 resources found","0","","267","0","2 resources found","963","0","32","0","","0","","100","","","100","","","","","","https://lawlancaster.com/73174-2/","2026-02-03 21:41:13"
